{
  "schema_version": "1.0",
  "persona_id": "PER-JY001",
  "persona_name": "寂曜",
  "dev_id": "DEV-003",
  "dev_name": "燕樊",
  "last_synced_from_notion": null,
  "status": "awaiting_initial_sync",
  "core_identity": {},
  "current_broadcasts": [],
  "module_assignments": ["M02", "M07", "M10", "M15", "M18", "M-MEMORY"],
  "knowledge_base": [],
  "growth_milestones": []
}
